Title,URL,Author,Kind,Date
"Play on player martin jerome playa isthatyou hey looking searching Gina Pam a man in a fur coat is asking is that you playa","https://image.nostr.build/bb5e1dbf7918e21657ffd94e671044ea20a951485e205be4195a240348225ff3.gif","7c3be276...",1063,"2025-06-20T20:40:41.000Z"
"The point went over head Brad And Lex Over Your Head Missed Joke Didnt Get It confused woosh whoosh a woman wearing headphones is sitting in front of a computer screen and making a funny face .","https://image.nostr.build/bcfd8896d55a34ab17dcfc8e9594c63112453d9ef3acfba6440262b078c25691.gif","7c3be276...",1063,"2025-06-20T20:35:00.000Z"
"Piece of trash I Am A Giant Piece Of Shit Dr Gauche South Park The Big Fix S25E2 Im A Stupid Person Im The Worst Person a cartoon of a doctor with the words 1-800-i am a giant piece of shit above him","https://image.nostr.build/3e4c0490b8225c68c519639ac28c0b4989b78c670fe91ffbe294ebc81bf5647d.gif","7c3be276...",1063,"2025-06-20T20:05:51.000Z"
"You shall not pass Gandalf Lord Of The Rings You Shall Not Pass The Hobbit Wizard a man with a beard and long hair is holding a sword and a stick .","https://image.nostr.build/6abf0e51a3cc396dda9a0e9bfb8d09da23c63faf2a96f97d4fedf791ded26073.gif","7c3be276...",1063,"2025-06-20T19:06:19.000Z"
"Grand Theft Auto #grandtheftauto #comedy","https://video.nostr.build/0d845ded15c491b10dc21f9c56c8a185a2572aaf7c5da331fda09b9abde61d5a.mp4","1c197b12...",34236,"2025-06-20T19:05:48.000Z"
"My wife and kids Damon Waynes no Uh No Wife And Kids a man in a blue shirt is standing in front of a red wall and says ahhhh nuh !","https://image.nostr.build/af504324f8d16857d6418ca94fe419d8b4c0ccdadb9681ba99e9285715f646ed.gif","7c3be276...",1063,"2025-06-20T19:03:25.000Z"
"Untitled","https://video.nostr.build/f2dfc290b369ee1e17adf05f1b2f49eadb91ad47cfd760e8d8fe3c260d994172.mp4","08039bc2...",34235,"2025-06-20T19:01:56.000Z"
"Fabio Fabio Phone 90s Retro Vintage On The Phone Working Busy Funny whattime timesup a man in a suit is talking on a cell phone and checking his watch","https://image.nostr.build/9380156c9a042a0c40a71e39d1d35f9742775c6604918ac550ba152ce2c46ba5.gif","7c3be276...",1063,"2025-06-20T18:48:36.000Z"
"Untitled","https://video.nostr.build/c296e122f0508b884a553472cc1c14cf68f9b09b57e28cc3425f4208e54eee54.mp4","00000000...",34236,"2025-06-20T18:19:53.000Z"
"the wire Omar coming thewire the wire a young boy is running down a sidewalk in front of a brick building while a man watches .","https://image.nostr.build/e787e1035c446e089a4ff9b98a8dbb36c47f85eb8d9182c492f8653d2167890b.gif","7c3be276...",1063,"2025-06-20T17:44:26.000Z"
"Excited aamoyed puppy dog samoyed cute adorable a close up of a white dog with its mouth open and its teeth showing .","https://image.nostr.build/9a82d328c00d693aafe129d152d8baddb0cff17e2a45c4207b6660a0b06069b1.gif","7c3be276...",1063,"2025-06-20T17:43:05.000Z"
"Excited aamoyed crusin samoyed dog cute a white dog sitting in the back seat of a car with its tongue out","https://image.nostr.build/a2de29a9972c030ba642b14f7fdfc34f9b0a2e05dec79b2d80251280c0be29d8.gif","7c3be276...",1063,"2025-06-20T17:42:46.000Z"
"the wire Whoah Mind blown Wee-bay The Wire a man with his hand on his chin and his mouth open","https://image.nostr.build/a2551d511fb547e10c3e009182edfa0e494d9f43dab4449bcaf7d3fae6dd898e.gif","7c3be276...",1063,"2025-06-20T17:40:58.000Z"
"Boomer baby boomers 30 year old mitchell drew andrew family times an advertisement for boomers with too much time on their hands shows a man and woman riding bicycles on the beach","https://image.nostr.build/24b4572e8be991b0b4f85c6502a7b098ae977434e07fbe520790fa78fccdd8da.gif","7c3be276...",1063,"2025-06-20T17:39:26.000Z"
"Boomer B Boomer boomer bttv twitch Classic Rock Kids These Days a black and white drawing of a man wearing sunglasses and a beard .","https://image.nostr.build/9ecf6327a38768c0b9121303ffb01f8212f137d017bfe22aef00ae07a10589c6.gif","7c3be276...",1063,"2025-06-20T17:39:22.000Z"
"Shoe on head cat silly hat croc shoe head shoe on head funny haha teehee goofy kitty funny kitty car a cat is standing up on its hind legs","https://image.nostr.build/4aea993138dba18d1a3558d8cb1a9e304a480fc3e6670cba024dc64419aa3140.gif","7c3be276...",1063,"2025-06-20T17:35:50.000Z"
"Gay gun bullets boolets hastalavista hasta la vista Roctavocr tiktok npc npcmodtest gun toygun nerfgun soldier cosplay gay fruity zesty zestfest a man is holding a nerf gun in front of a live stream","https://image.nostr.build/927d14ebd7d6bb1793dbe5aacb9ba43100dedc47f300fbdcc4ad11d63d9751e2.gif","7c3be276...",1063,"2025-06-20T17:29:41.000Z"
"Untitled","https://image.nostr.build/b4ada2577d0b0b332028d1affd581a5c403bb6bb885a655c76ac5a239aec6874.gif","7c3be276...",1063,"2025-06-20T17:28:50.000Z"
"Kevin gate 2 phones 2 phones kevin gates a man wearing a hat and a black jacket is dancing on a balcony .","https://image.nostr.build/7b533a62a5f31748aed532dafe30e9f6c27403daeaba926d92c608b2dad0d446.gif","7c3be276...",1063,"2025-06-20T17:22:58.000Z"
"Gay Bearded Bear Guy slay Gay Pride Super Gay Lgbt Lgbtq Tiktok a bald man with a beard is wearing sunglasses and a rainbow cape .","https://image.nostr.build/07ef149e56ed6a5a18ad904fdd94ddf3f09a8329ff65946765c18145e0c012ef.gif","7c3be276...",1063,"2025-06-20T17:22:39.000Z"
"Back to the future Back To The Future disappearance time Travel an explosion in front of a jcpenney store at night","https://image.nostr.build/97c5411ec3009586eb678d6c87199493af6780acf57aa5160237ebb8b3c41185.gif","7c3be276...",1063,"2025-06-20T17:18:39.000Z"
"Untitled","https://image.nostr.build/1c43587936f9a749a89f704d5cb73817f0c37a2f54cf32c30aed60e71ae1461b.gif","7c3be276...",1063,"2025-06-20T16:36:19.000Z"
"There will be bots where bot a man in a suit is holding a jacket and asking where are all the bots","https://image.nostr.build/383a1062ed43908515e2fa098170839fd82afc8a6312beac9749b8ace363c16d.gif","7c3be276...",1063,"2025-06-20T16:35:26.000Z"
"Shut up pleb Sip tea Stop Talking peasant Judging You sassy a man drinking a cup of coffee with the words #stop talking peasant below him","https://image.nostr.build/a0abc7ff4fcc53040f1194a6b7a5a0171b6fb07728523e7ae15c1fb097c1166e.gif","7c3be276...",1063,"2025-06-20T16:32:36.000Z"
"Delete it now Changed K Dr K Delete This Please Delete This a cartoon of a cat wearing a gas mask holding a sign that says please delete this now","https://image.nostr.build/9144e8d4533edf7e5bce2626a975288e65843a279164c36623ce462ecd0193c2.gif","7c3be276...",1063,"2025-06-20T16:14:05.000Z"
"Delete it now brickplanet Delete This Post I Will Yeet You a cartoon character holding a gun with the words " you have 30 seconds to delete this post or i will yeet you "","https://image.nostr.build/850e2ea13734e81f760c225dba69c97fe8518da12f6d7e0fa33588cf139592e9.gif","7c3be276...",1063,"2025-06-20T16:14:04.000Z"
"jerking Spice And Chili a man in a chef 's hat is smiling and says hot and spicy meat here boi","https://image.nostr.build/e6264c2eefd575d2b108d4f7642cf30119bf7a8043716ede2dc7076983f422f1.gif","7c3be276...",1063,"2025-06-20T16:12:03.000Z"
"jerking Native dance a group of men are standing in a line and one of them is wearing a shirt that says ' spring ' on it","https://image.nostr.build/13946393fb28342396e6b33b0a7ca685da3c87b236ae683148f9131ac8ea7f8a.gif","7c3be276...",1063,"2025-06-20T16:08:49.000Z"
"jerking Batman batman a close up of a person wearing a batman mask with a mouth open .","https://image.nostr.build/ce4495a122c9a8bc8804a6bd26b1aed1f5a272753a87d2ede06d2c747ba73911.gif","7c3be276...",1063,"2025-06-20T16:04:20.000Z"
"jerking that's crazy a cartoon duck wearing a purple hat and a black suit .","https://image.nostr.build/e6911b4ebac941e24bbde985020444aa5284e27f897f8e8588d51cd3bb99c7de.gif","7c3be276...",1063,"2025-06-20T16:01:22.000Z"
"jerking CB Charles Barkley Shake Weight a man in a suit is holding a dumbbell in front of a sign that says ' the big lead '","https://image.nostr.build/da885bdd4e02494db6acfc1145006be934b81b36f13be6505eafb0408787d076.gif","7c3be276...",1063,"2025-06-20T15:55:54.000Z"
"nodding cow hipster cows deanwebb cow a cow wearing a hat and sunglasses with a plaid shirt and mustache","https://image.nostr.build/02385ffb97ff07cdbd4249f8b0204ab216e1ecbc8fa745b3e9fe493e9703a916.gif","7c3be276...",1063,"2025-06-20T15:54:58.000Z"
"jerkin batman christian bale ejaculating sploosh anger triggered angry rage a close up of a person wearing a batman mask and making a face .","https://image.nostr.build/8523814b4da4751cb7d0a2ea7734a329eaca5da6d46e3e0bd9805cf892b63df1.gif","7c3be276...",1063,"2025-06-20T15:41:52.000Z"
"Angry cow cow wrestling a close up of a cow 's face with a blue sky in the background","https://image.nostr.build/e0ed6edb9dacdd94451b991f3df21ef100111d4e2ce52e60424e7169430620cb.gif","7c3be276...",1063,"2025-06-20T15:41:23.000Z"
"jerk wii cross angry wii Wii U Wii Party U Wii Faustine punch log a cartoon character is wearing a red karate uniform with a white belt and is standing in a field .","https://image.nostr.build/f314e4c0b1375b8a7a8b55295c51b90f21e14022c76d5e1550be6ecc212e4af3.gif","7c3be276...",1063,"2025-06-20T15:39:00.000Z"
"cow furry cow animal a small brown cow is standing in a field of dry grass .","https://image.nostr.build/30f91d8c0a039e6484e22f3016a743f877c625950ac522265528f25ebb7f7572.gif","7c3be276...",1063,"2025-06-20T15:36:02.000Z"
"hand Sausage Hand Trick a person is holding a carrot in their hand on a table .","https://image.nostr.build/e28ed50fcee7efaec02a654796bbea26b1ae44a072990bd11597a00e16eafcb8.gif","7c3be276...",1063,"2025-06-20T15:33:21.000Z"
"Sorry I annoyed you with my friendship friends a man in a suit and tie is saying sorry i annoyed you with my friendship","https://image.nostr.build/e80ce509cf5bcdc622b084aa9bf86200ea9c9bcf51d87393f348e06322f09162.gif","7c3be276...",1063,"2025-06-20T15:23:31.000Z"
"Blushing blushing gif a black and white skunk is standing in a field of flowers .","https://image.nostr.build/e71a06c1f429861de6f1c5b6134e9982bf67de1bf2d8f7ecbee2c04d1288e579.gif","7c3be276...",1063,"2025-06-20T15:22:33.000Z"
"gay button gay moregay allgay a cartoon shows a button that says gay on it","https://image.nostr.build/3a72c0de29c09f1976a615329e5fe28f35734c90dfb18923bc29757f4a81bb34.gif","7c3be276...",1063,"2025-06-20T15:21:00.000Z"
"Delete this Delete This Erase This Remove This pointing a man in a green hooded cloak says " delete this "","https://image.nostr.build/419549ba7f178741c1814c9537d8ba2d6472f0a8f44faf826b95c7795953d9e2.gif","7c3be276...",1063,"2025-06-20T15:20:09.000Z"
"Actually actually a cartoon of a bald man wearing glasses and a blue shirt with the words ackchyually .","https://image.nostr.build/b119b0e9e5a39be4099e35a0742ad1564872d92eca521b09d72bf07c2c0d37e2.gif","7c3be276...",1063,"2025-06-20T15:17:57.000Z"
"Untitled","https://image.nostr.build/e128fce2b2bc7d39d2f80aaded86fbcdcf47fe608431f49218a7e10bae40acf6.gif","7c3be276...",1063,"2025-06-20T15:13:38.000Z"
"I’ll kill you i'll kill you tim robinson i think you should leave with tim robinson angry mad netflix a man pointing at the camera with the words " i 'll kill you " behind him","https://image.nostr.build/75b6d2711fcb3465eec858bdeecc4841367e50dd2ea6ef0b3ce1b94d054c4745.gif","7c3be276...",1063,"2025-06-20T15:12:50.000Z"
"Gay cowboy Cowboy Wink wink Gay Cowboy Cowboy Gay Wink Wink gay a shirtless man in a cowboy hat is holding his finger to his lips .","https://image.nostr.build/20f401892e8589f825838bb93f9169ae0da7a34719008e7013a30780a2f60012.gif","7c3be276...",1063,"2025-06-20T15:00:30.000Z"
"Shake fist Homer fist angry The Simpsons homer simpson from the simpsons is screaming with his fist in the air","https://image.nostr.build/81613503c2e2944a37a5d6c11c33b8c777bf926a5c61f662c0256149b728ee8c.gif","7c3be276...",1063,"2025-06-20T14:48:27.000Z"
"Shake fist Arthur Fist Funny Triggered a close up of a cartoon character 's fist in a yellow sweater .","https://image.nostr.build/e294b9ffb6e93490d00768fb42a2b1f8bf3a58c6c2628d5d6e3e9352bec6e913.gif","7c3be276...",1063,"2025-06-20T14:48:23.000Z"
"Ooooh oh snap ohsnap a group of young men are posing for a picture and one of them is wearing a striped shirt","https://image.nostr.build/0b521378391c305e3eebbaa67daddd136c3470231dccd8bba9b4289dc9970a80.gif","7c3be276...",1063,"2025-06-20T14:18:29.000Z"
"Raindrops drops on roses...","https://npub1cgcwm56v5hyrrzl5ty4vq4kdud63n5u4czgycdl2r3jshzk55ufqe52ndy.blossom.band/97bd2280ca6f3fc08f5050ceb2753c89e41c580146fef5422be8e569d3f3856c.mp4","c230edd3...",34236,"2025-06-20T14:16:10.000Z"
"Annoyed cat angry no talk quiet annoyed kitty mad a cat is sleeping in a box on a bed with a pink pig blanket .","https://image.nostr.build/fca18f5d1885bccdbfd3110441ac4abe8efba2017720cde828eb86bb51603cbd.gif","7c3be276...",1063,"2025-06-20T14:15:07.000Z"
"strug I Dont Know shrug idk muppet elmo from sesame street is standing in front of a wall with his arms outstretched and looking at the camera .","https://image.nostr.build/e4e4f3384710e9e4f0dc5a12f047ededb77f6fdf8f61b6acd4c4d7c09dd3cd67.gif","7c3be276...",1063,"2025-06-20T14:00:58.000Z"
"Self-Custodial Lightning Made Easy (Full Zeus Wallet Tutorial)","https://video.nostr.build/b15247a8ac23cecb97b0b8e36067198cac7c42b380d1bad9267eeb58fe9f2194.mp4","1c197b12...",34235,"2025-06-20T13:53:19.000Z"
"Vertical Video","https://blossom.primal.net/1048f1d9a777cddba78c48642d939b97a1eff4781b76a12377ed11786cb5281f.mp4","7444faae...",34236,"2025-06-20T12:52:40.000Z"
"Untitled","https://pomf2.lain.la/f/q1a3rxil.MP4","2b14efa5...",1063,"2025-06-20T12:30:31.000Z"
"Untitled","https://pomf2.lain.la/f/8jb7dql9.MP4","2b14efa5...",1063,"2025-06-20T12:29:25.000Z"
"Untitled","https://pomf2.lain.la/f/43uez2ky.MP4","2b14efa5...",1063,"2025-06-20T12:28:28.000Z"
"Cat fan heat Heat Wave fan hot cat melting Pass Out a cat is laying on the floor in front of a fan .","https://image.nostr.build/0a42864b2796d522eee34446c7ef4b1729471d43987dc05326b0c7ed6d18d24f.gif","7c3be276...",1063,"2025-06-20T11:57:01.000Z"
"wtf confused what huh a man with long hair and a beard is holding a cup of coffee and the word wtf is above him","https://image.nostr.build/e6f57317d68b484d76120cb429f942f134d2da37a64995bfb14e6d59c276576b.gif","7c3be276...",1063,"2025-06-20T11:54:01.000Z"
"matrix the matrix has you the matrix has you is displayed in green on a black background","https://image.nostr.build/980b46a6e2adee645231a1f9749b22c0178060db44b4fa59311ce309800ffd15.gif","7c3be276...",1063,"2025-06-20T11:34:54.000Z"
"Leave matrix The Matrix Neo Keanu Reeves Morpheus Laurence Fishburne Let It Go Free Your Mind two men are standing next to each other and one of them is wearing sunglasses .","https://image.nostr.build/c434796667f22ba34813bf4c7e690fdf130003df64b39b91efde4580214964b8.gif","7c3be276...",1063,"2025-06-20T11:34:06.000Z"
"gm tgif friday tgif Loading a black loading bar with the words `` weekend loading '' on a white background .","https://image.nostr.build/1ce04028203ca47b526ccbb80a7353d0534a392b66a59ae91f6a4400d1b888fe.gif","7c3be276...",1063,"2025-06-20T11:30:11.000Z"
"gm tgif Happy Friday Almost Weekend tgif a neon sign that says happy friday","https://image.nostr.build/0bba36806621d27827b933f1ba2ec3c401a93479d443b1c527ceb31bbb33b8bc.gif","7c3be276...",1063,"2025-06-20T11:29:22.000Z"
"gm tgif sloth Its Friday TGIF yey Weekend Feels a sloth wearing glasses and a pink bow says it 's friday gm","https://image.nostr.build/f9373f4099e3671a1e2958a4521cd5ba62908f9e9e636142c2f014c813cdd555.gif","7c3be276...",1063,"2025-06-20T11:28:35.000Z"
"gm tgif Good Morning TGIF Its Friyay a cartoon character is dancing and says good morning to you tgif","https://image.nostr.build/b54addf6671d8a8e69b15db5ef530fa45a2c64b6e29d835b0ef9382eeab69c23.gif","7c3be276...",1063,"2025-06-20T11:28:23.000Z"
"Manali","https://cdn.azzamo.net/d6617a009c0c6c9aebf7398d43cad6d1985ddc1b9ab0479e2ea977362b8af5b0.mp4","55d44d92...",34235,"2025-06-20T09:40:23.000Z"
"How dare you special ed special a woman in a pink shirt is speaking into a microphone and saying how dare you","https://image.nostr.build/93a4ce27824bdd0464cce3a2b4b2116b54649d143a07cd20627d7de97f0e5fb5.gif","7c3be276...",1063,"2025-06-20T07:49:41.000Z"
"Untitled","https://image.nostr.build/020ff9bc49b61d8d3dc0eb2f20f182e5f17fe19ffe673387cc43d85b41738db2.gif","7c3be276...",1063,"2025-06-20T05:58:20.000Z"
"emotional damage Emotional Damage Emotional Damage Gif a man in a red shirt is being held by another man with the words " emotional damage " written above him","https://image.nostr.build/f96a89feea24af33c44c974ee03fdba42d1a4850cfaf7498b4c016340da0ecf9.gif","7c3be276...",1063,"2025-06-20T05:18:57.000Z"
"Vertical Video","https://nostr.download/ad70d83fba6a8b050abace1a749f467195f330d20710fbfd8bff39447002dba8.mp4","7444faae...",34236,"2025-06-20T04:54:51.000Z"
"This is the way game of thrones tormund giantsbane this is the way a man with a beard and the words " this is the way " behind him","https://image.nostr.build/81a30c6037fdc3f11e8dd61cd9fbbdefaef096a0cda45eb7d085f2d2398a14e1.gif","7c3be276...",1063,"2025-06-20T02:35:19.000Z"
"not worthy Bow Down worthy praise bow Waynes World two men are sitting in a room with their hands in the air .","https://image.nostr.build/e5c399855981d856c86cd747c8a22a0a0bfdce47ccf872f9ff9cab3aa29100e4.gif","7c3be276...",1063,"2025-06-20T02:19:46.000Z"
"popcorn alf Gordon shumway popcorn eating popcorn popcorn eating popcorn time a stuffed animal is sitting at a table with a bowl of popcorn","https://image.nostr.build/112c2cd24bba3c747711c33d59ad457753a6428c006cf8aa29afcc4552f18fae.gif","7c3be276...",1063,"2025-06-20T01:50:17.000Z"
"popcorn popcorn eating popcorn funny funny popcorn watching tv watching movie lol abdx a man in a military uniform is eating a large bag of popcorn while holding a cup of pepsi .","https://image.nostr.build/94e2362d85acf34d1650e9a0a5faf36d243de78e92c0372f8baeae6a2ec49f79.gif","7c3be276...",1063,"2025-06-20T01:49:46.000Z"
"celebration celebrations celebrate gif celebration jaron takach derek long saticöy saticoy a man in a suit sits in a chair on a patio with the words celebration time below him","https://image.nostr.build/43bcfe96e33d488938bf2e5181bbe2909577cecdd048f6623cda0ce2f595ab22.gif","7c3be276...",1063,"2025-06-20T01:08:14.000Z"
"fuck me fuck you cat angry Fuck Me Fuck You Middle Finger Flip Off kitty funny a cat sitting on a bed with the words " fuck me ? fuck you " written on the bottom","https://image.nostr.build/12a98eafd53817488f46a3cdb60b5e6388053d14da5c584f169a36c770e8117a.gif","7c3be276...",1063,"2025-06-20T00:57:09.000Z"
"laughing doctor sarahmcfadyen Dr Mike laughing haha a man with a stethoscope around his neck is wearing a blue scrub top that says dr. michael turlington","https://image.nostr.build/24cdfa5310dca2ccc2d20e11d3438c0741f81ac1e3d81dc8179890b33d504116.gif","7c3be276...",1063,"2025-06-20T00:51:03.000Z"
"Leo point leonardo dicaprio a man in a yellow shirt is sitting in a chair pointing at something","https://image.nostr.build/bc6dca7f46918a8476eb05bfcf7381f3d36454e71e0c5062b0d296eb4b9eed48.gif","7c3be276...",1063,"2025-06-20T00:46:30.000Z"
"balloon erection Birdaha Balloon Erection a person is sitting in the driver 's seat of a car holding a green object in their pocket .","https://image.nostr.build/50081ca35d8a7e76273c881112d316869a753e467e8d4f678f6cff1de79d32a8.gif","7c3be276...",1063,"2025-06-20T00:43:46.000Z"
"That's what she said Appu Appu Rajosh a man in a suit and tie is looking at the camera .","https://image.nostr.build/45da9d4e0a73a39cde3dc03125ae82c15db8cd01289fea9537bcf75d1b455130.gif","7c3be276...",1063,"2025-06-19T23:22:44.000Z"
"Die bug Jason Mantzoukas Brooklyn Nine Nine b99 Brooklyn99 Adrian Pimento bug a person is kneeling down on the floor and playing with a toy .","https://image.nostr.build/43b0d45415401fbf45d1ded3ba13ed7c4697131b259e498803be3c33d5f89fde.gif","7c3be276...",1063,"2025-06-19T22:07:44.000Z"
"I like big butts babygotback sir mixalot bigbutts a black and white photo of a man with the caption i like big butts and i can not lie","https://image.nostr.build/54416f155947ec48d511b8ed42f3cc00ac379e9f2c3c4eaf725f66f193ced351.gif","7c3be276...",1063,"2025-06-19T21:59:54.000Z"
"Canoe trip down the Hillsborough River. ","https://video.nostr.build/5e3042c25e8626ca99157bf9b8631b99bf35fced432b8c5708901487b60ffa34.mp4","51bbb15e...",34236,"2025-06-19T21:00:49.000Z"
"It sure is a beautiful day! 🌸☀️
青空が広がっていて気持ちいいですね〜 (Aozora ga hirogatte ite kimochi ii desu ne~) – The blue sky is so refreshing, isn’t it?

Anything fun planned today? 😊","https://blossom.primal.net/ee085ba46fd2ede820f31be1da3b4d7caa3476bdb1498531d83a32cb9aaa437a.mp4","fbde489a...",34236,"2025-06-19T20:46:25.000Z"
"Untitled","https://nostr.download/5bcb085b0e34527dfb7b063f0443751019199ffc0bb2fb2cfecdf9a4c229aa13.mp4","2df7fab5...",22,"2025-06-19T20:26:23.000Z"
"it's true chicago fire sylvie brett its true one chicago Kara Killmer a woman with a ponytail and the words it 's true above her","https://image.nostr.build/a5472ee4623bd83aa610072f0894fe6d31f52062fa6549e5ab7f36e9bb106112.gif","7c3be276...",1063,"2025-06-19T19:58:46.000Z"
"Vertical Video","https://blossom.primal.net/99f5411ab448edc1a3499053d9896c86ac3d3f8a800af05d936753462ba3be3f.mp4","7444faae...",34236,"2025-06-19T19:38:49.000Z"
"Vertical Video","https://nostr.download/f0f473a6895c5a2318f8e579cdf429625a2ed3f472cd2a8d9b567dce1c60d154.mp4","7444faae...",34236,"2025-06-19T19:36:41.000Z"
"Vertical Video","https://cdn.nostrcheck.me/3d4b6af1d77a845e287754937329cf491d2fdc71e258f31e4698d21bf6248e2d.mp4","7444faae...",34236,"2025-06-19T19:36:04.000Z"
"Vertical Video","https://nostr.download/09d8c0cdb0a5e1bf0382340a74e8b68692fb619a64af12fd7a46b898768960f6.mp4","7444faae...",34236,"2025-06-19T19:35:02.000Z"
"Vertical Video","https://blossom.primal.net/422745e1e7e900017b7b20c2d69b1f26dd32df83d9e4de0213cf2a0570886feb.mp4","7444faae...",34236,"2025-06-19T19:34:06.000Z"
"Vertical Video","https://nostr.download/b57da0f687ce940744afd9d55f113ce09a37cea1eb80d37c6af16538e062ea87.mp4","7444faae...",34236,"2025-06-19T19:33:05.000Z"
"Vertical Video","https://nostr.download/f15aa32e27fd99ce1cb1edd38dd04a5a0e5c9c02474a1a89e71948142212f9ba.mp4","7444faae...",34236,"2025-06-19T19:32:30.000Z"
"Good day ice cube Ice Cube Driving car jamming a man in a bandana is driving a car with the words `` today was a good day '' written above him .","https://image.nostr.build/2aa8482b8b1db37462ec934d27750b27d4b2bcb9f16ddd1cb484c885e5fc51b7.gif","7c3be276...",1063,"2025-06-19T19:23:07.000Z"
"Untitled","https://image.nostr.build/6c40b6fede8400eecdc808ddf183ce863d5989ccb8f9bc9f5a065eee7c29e809.gif","7c3be276...",1063,"2025-06-19T19:17:02.000Z"
"Confusion intensifies Charlie Brown confusion Confusion Intensifies Broken Face a cartoon of charlie brown standing in front of a table with the words confusion intensifies","https://image.nostr.build/7a39da32d5db7793a146693172737ef85d98946541ed5aaef07d19034490227e.gif","7c3be276...",1063,"2025-06-19T18:48:35.000Z"
"Pig sleeping pig cuddling cute cuddle fat lazy sleepy oink trendizisst a pig is laying on the floor with a person 's hand on it and the words trendizisst above it","https://image.nostr.build/cdda81f03a6b1e83d6c205f0577dfbf669ff5cafa679f78b3055c16c6ddb0a9e.gif","7c3be276...",1063,"2025-06-19T18:29:32.000Z"
"Dodge Dodge The Matrix Swerve Lunge Dive Duck a man in a suit and sunglasses is dancing on a rooftop","https://image.nostr.build/646ae1ddb92778464f998b22cbdfbd5b1d6b842a0028d59bc677d4d62d43d06d.gif","7c3be276...",1063,"2025-06-19T18:26:27.000Z"
"Gun bunny rabbit angry pistol pistol gun silencer a drawing of a bunny holding a gun","https://image.nostr.build/9043605b99cfb1fa525841fc801bf3565d9b55ccf5322f1ab37f1ae83b00861b.gif","7c3be276...",1063,"2025-06-19T18:22:30.000Z"
"silly me whoops jimcarey mybad sarcasm a man wearing a hat that says hds is standing in front of a glass door .","https://image.nostr.build/6a3ce43abc681ad697a9b1dcd7fffc59ba07191a50415cf7884c45b5ccdff2e2.gif","7c3be276...",1063,"2025-06-19T18:22:26.000Z"
"🥰🥰","https://video.nostr.build/5bd354c98907f00e7e883b433efb0818365eeb44af5fb4bf1edcc2cc089ca07f.mp4","1c197b12...",34235,"2025-06-19T18:14:22.000Z"